RepJackBergman,b'I applaud Chairman @MacTXPress for including language in the FY19 NDAA highlighting the critical role the Soo Locks play in our national security. \n\nhttps://t.co/siuFtpHhxt',Republican
RepBrianMast,b'Big wins for local water coming out of our Transportation &amp; Infrastructure committee hearing today.  Read about it here: https://t.co/iVshSJxaTZ #SendTheWaterSouth',Republican
RepTrey,"b'The DRIVE-Safe Act enables truck drivers across the district and across the state to deliver goods in a safe, timely manner, attract the workforce they need, and create Hoosier jobs \xe2\x86\x92 https://t.co/jwaeYEzT18 @WISH_TV'",Republican
RepPaulMitchell,"b'Last night, the House overwhelmingly passed the bipartisan FIRST STEP Act, which provides inmates the support they need, while strengthening public safety &amp; enhancing prison security for all. https://t.co/1HcmS8RYAX @HouseJudiciary'",Republican
RepDrewFerguson,b'Another example that #TaxReformWorks. This is great news for #GA03! https://t.co/c0LEczD5Jd',Republican
housebudgetGOP,"b'#BudgetFact: Thanks to #TaxReform, optimism in the job market is at a 17-year high + 67% of Americans feel they can find a good job. Read more: https://t.co/pRWR06i2qz'",Republican
amashoffice,"b'""Grand Rapids is becoming a destination city not only for beer but for entertainment, art, food, and more."" https://t.co/ZbqtpVTgA8'",Republican
WarrenDavidson,"b'#winning #DoddFrank made big banks bigger and small banks fewer. That trend is not good for America. This bill is good for America, it is bipartisan, and thankfully it will soon be the law of the land. https://t.co/b4OUPtLx6w'",Republican
RepLaHood,b'@scottwongDC Why not make it exciting?',Republican
HouseSmallBiz,"b'#BREAKING: Chairman @RepSteveChabot Hails Passage of S. 2155: ""The reforms included in this package, which will now be sent to @POTUS\' desk, will put American Main Street businesses on the path to job creation and expansion."" https://t.co/x31T9REsnS'",Republican
RepMiaLove,"b'Good to see the U of U\xe2\x80\x99s \xe2\x80\x98Go Learn\xe2\x80\x99 program in my office this week. We don\xe2\x80\x99t see eye-to-eye on everything, but it was good to have a discussion about tough topics like #schoolsafety and #immigration. #utpol https://t.co/zpInOtX1Gf'",Republican
CongressmanHice,b'LIVE NOW: Confronting the Democrats\xe2\x80\x99 partisan gamesmanship over the 2020 Census asking individuals if they are an American citizen. Tune in here: https://t.co/TwxmszAJ8i \xe2\x80\xa6 https://t.co/b2RX8NugEm',Republican
RepBuddyCarter,b'The launch day for the 2018 Congressional App Challenge is coming up. I enjoyed meeting the previous winners from Richmond Hill Middle School and learning about their Wing Finder app while they were in D.C. I encourage middle and high school students in #GA01 to participate. https://t.co/29Vlco1Q15',Republican
RepJohnKatko,b'LIVE now with @gracenapolitano @RepDonBeyer on Engaging and Supporting Families in Suicide Prevention  #mhm2018 #EndStigma --&gt; https://t.co/zU8m84IDv3',Republican
RepRussell,b'It was great speaking with @BBCNews earlier this week. We discussed Iran and North Korea.\nhttps://t.co/XDDXZVsh5P',Republican
RepMarkWalker,"b'Last fall, four NC prison workers were tragically killed in an attempted jailbreak. We have to make our prisons safer for employees and more effective at rehabilitating inmates. Last night we passed the important #FIRSTSTEPAct to do both \xe2\x86\x92 https://t.co/CQHSlDUjly #NC06 #ncpol'",Republican
RepRodBlum,"b'Chatted with Iowa Plumbing, Heating, and Cooling today about the need for workers in Iowa. I support LEGAL immigration and welfare reform- I am confident that these reforms will alleviate the worker shortage we are seeing in #IA01 https://t.co/btV1yJYG8q'",Republican
RepRickAllen,"b""I had a great meeting with the National Air Traffic Controllers Association this morning. I'd like to thank all of our Air Traffic Controllers for the important work that they do everyday to ensure the safe and orderly flow of air traffic! https://t.co/C9pUHVxpSM""",Republican
HurdOnTheHill,"b""LISTEN \xf0\x9f\x8e\xa7: Talked all things #nationalsecurity with Former #CIA Acting Director Michael Morell on the latest @IntelMattersPod #podcast. Spoiler alert: it's a good one. https://t.co/FYThR5QOBY""",Republican
RepTomMacArthur,"b'Whether in NH or NJ, addressing substance use disorder cannot fall victim to partisan politics. @RepAnnieKuster and I submitted this column to the @BurlcoTimes to outline efforts of the Bipartisan Heroin Task Force. https://t.co/Lutmsyziyt'",Republican
RepAbraham,"b'After further review, it looks like the NFL actually make the right call and listened to the will of the fans. #LA05\n\nhttps://t.co/6gzsQTVUj7'",Republican
RepStefanik,"b'ICYMI: This week the House passed a series of measures to better support our veterans. As the proud Representative of more veterans than any other Member of Congress in New York, I will continue to prioritize their needs. Learn more: https://t.co/FocALmNL4i'",Republican
RepFrenchHill,"b'The best are found in Bald Knob, Arkansas at Bulldog. \xf0\x9f\x8d\x93\xf0\x9f\x8d\x93\xf0\x9f\x8d\x93 https://t.co/0D8ETAl68n'",Republican
RepRyanCostello,b'We all agree the men &amp; women who sacrifice so much to serve our country deserve the best service possible when they come home - and when they are preparing to deploy. That is why I introduced this commonsense legislation. Learn more about my bill here: https://t.co/YWKfTZOhQ3',Republican
RepRyanZinke,b'Just a reminder: Please follow @SecretaryZinke for updates on my work with @Interior - I will no longer post updates to this account. #mtpol',Republican
RepGarretGraves,"b'Happy to vote with my colleagues today to advance legislation that will directly impact Louisiana\xe2\x80\x99s flood protection, maritime, coastal, environmental and other water resources-related interests. https://t.co/WGBQWdmKDA'",Republican
RepComstock,"b""The House passed the Right to Try Act of 2017 yesterday. This legislation passed the Senate and will now move to the President's desk to become law. #VA10 #RightToTry https://t.co/UyXqWZV8sb""",Republican
RepPoliquin,b'@HouseVetAffairs Read more about the provisions I pushed for in the #VAMISSIONAct and how this is going to help so many of our Maine Vets: https://t.co/AvcQxnROfm\n#mepolitics',Republican
RepNewhouse,"b'Columbia River Treaty negotiations are long overdue, and I applaud the Trump admin for getting ball rolling on renegotiating this treaty that has a tremendous impact on our way of life in #WA04 and the PNW. Story via @TriCityHerald: https://t.co/RX6dCuGZZx'",Republican
RepBrianBabin,"b'Thanks @FoxNews for having me on to talk about a way to make our schools and communities safer. Watch the floor speech I gave on this, the night before Santa Fe shooting. https://t.co/zx6C92ikwT. #TX36 https://t.co/nAzSY1wrxK'",Republican
RepMikeBishop,"b""My #bipartisan bill would curb the flow of synthetic opioids being shipped into our country by giving law enforcement new tools to detect suspicious packages. This is just one of 60+ bills we're advancing to combat this devastating epidemic: https://t.co/8tcNxeO5f9""",Republican
RepTomEmmer,b'I\xe2\x80\x99m joining @foxnewsnight tonight w/ @ShannonBream to discuss how @POTUS is working to unleash Minnesota\xe2\x80\x99s mining potential. Tune in to @FoxNews at 10:35pm CT/11:35pm ET!',Republican
RepLoudermilk,b'Today would have been Dustin Inman\xe2\x80\x99s 34th birthday - he was only 16 when he tragically lost his life and the man responsible has yet to be brought to justice. This is why we need to #SecureOurBorders\n\nhttps://t.co/z9PfAF2EHm',Republican
repdavetrott,"b""In today's @detroitnews \xe2\x86\x92 I believe President @realDonaldTrump made a great choice in @SecPompeo. Read my column: https://t.co/lsKO7V9Hot""",Republican
RepKenBuck,"b""If you're a student in the 4th Congressional District, I encourage you to participate in this year's app challenge. We've had some great apps the last three years, and I'm looking forward to seeing what students create in 2018. https://t.co/wJBrMujG66""",Republican
USRepGaryPalmer,"b'The First Amendment encourages open debate, not the stifling of ideas in the public square. View my questions from a recent committee hearing on this topic here: \nhttps://t.co/nVSA5L6NNo'",Republican
RepCurbelo,"b'On #WorldTurtleDay what better way to celebrate than a shout-out to the great team at @TurtleHospital in the #FLKeys. Each visitor allows them to keep up their important work to conserve, rehabilitate, and release \xf0\x9f\x90\xa2\xf0\x9f\x90\xa2 https://t.co/CoovuvwSFY'",Republican
RepWesterman,b'NEWS: Westerman Introduces Land Exchange Bill for Local Church https://t.co/kVkc87wLFw #ar4 #arpx #arnews',Republican
RepLeeZeldin,"b'VIDEO: Today, I joined @realDonaldTrump on Long Island w/ my NY colleagues @RepPeteKing &amp; @RepDanDonovan for a roundtable discussion re efforts to combat MS-13. Watch my remarks here: https://t.co/HsH02LlVpH'",Republican
RepMoolenaar,"b""Today, @HouseAppropsGOP passed legislation increasing funding for the Highway Trust Fund by a billion dollars to $46 billion. This means more money for federal roads &amp; I will continue to advocate for additional funding to fix our country's most important infrastructure needs.""",Republican
RepByrne,b'Another important reform bill headed to @POTUS for his signature! I was proud to support the #VAMISSIONAct when it passed the House. https://t.co/CimKko61D5',Republican
RepGuthrie,b'I enjoyed speaking to @KBT4AllModes this morning! Thanks for having me! https://t.co/gEYsEDqimX',Republican
RepBlainePress,b'The Farm Bill is critical to our Missouri-03 farmers and rural communities. This week I had the opportunity to discuss the Farm Bill with Kermit Miller from @KRCG13 while he was in Washington DC https://t.co/wJrNJmQBUH',Republican
RepJasonSmith,b'It is now up to us to provide families with the certainty that these new rates will be there for them in the future as they plan for their lives.',Republican
RepSanfordSC,b'Our office was able to work with the Committee on the inclusion of three important topics that have direct impact on the Lowcountry... https://t.co/vDflcZgjrZ',Republican
USRepLong,"b'In May, the @HouseCommerce Committee approved over 60 bills addressing the #OpioidCrisis. Read more about what we\xe2\x80\x99re doing to fight this epidemic \xe2\xac\x87\xef\xb8\x8f  https://t.co/SG4LQJUuab'",Republican
USRepRodney,b'Great meeting today with the @AAOrtho including Dr. Douglas Harte of Livingston. Very informative conversation about higher education issues. Thanks! https://t.co/C2RZS6ImgW',Republican
Rep_Hunter,"b'In case you missed it earlier, I discussed the Clint Lorance case and other issues with Col. Denny Gillem on Frontlines of Freedom.  Listen to the full interview here: https://t.co/DcEdKg4NCs'",Republican
RepChrisSmith,b'Today\xe2\x80\x99s new CDC numbers on autism regrettably show a greater prevalence\xe2\x80\x94up 20% in NJ to 1 in 34 kids.  This quantifying of prevalence of autism\xe2\x80\x94mandated by my legislation\xe2\x80\x94helps us fight for &amp; secure much-needed fed support for treatment &amp; education of children w/ autism.',Republican
SteveScalise,b'I spoke with @TeamCavuto this afternoon about the importance of keeping up the pressure so the House can get the information we need from the FBI. https://t.co/jvbEWEVbTE',Republican
KeithRothfus,"b'Fuel-secure nuclear and coal-fired power plants provide safe, reliable, &amp; resilient electricity that millions of Americans depend on. Read more about it in my latest Op-Ed with @RepMcKinley:  https://t.co/zaVpfvkwXN'",Republican
HouseJudiciary,b'@RepGoodlatte @RepMcCaul @Raul_Labrador @RepMcSally and many others working hard to #securetheborder and get immigration reform through the House. https://t.co/ZOI5Qxo6Ob',Republican
RepDavidValadao,"b""Enjoyed hosting Central Valley resident, Jessica, for #FosterYouthShadowDay. I'm beyond inspired by her story and grateful for all she does to give back to our community. Together, we can improve foster care in California. https://t.co/GS6smqouvK""",Republican
RepJBridenstine,"b'Happy 227th Birthday to the US Coast Guard, founded in 1790 by Alexander Hamilton. #SemperParatus'",Republican
RepAndyBarr,b'I am diligently working with my colleagues in the @FinancialCmte to pass pro-growth policies that will reduce the regulatory burden on our community financial institutions and unlock access to key financial services for all Kentuckians. https://t.co/LNj9lWLVXC',Republican
RepRWilliams,b'@Authentic_EI @GovWaste I promise you I am working hard to ensure these tax cuts are permanent for all Americans.',Republican
RepPaulCook,b'I issued the following statement on the #IranDeal https://t.co/f5H49KgIJZ',Republican
SusanWBrooks,b'Sending my thoughts and prayers to former Indiana First Lady Susan Bayh and her family as she battles cancer and undergoes treatment. I join the community in praying for a full recovery. https://t.co/nMErhD5TpL',Republican
RepChrisStewart,"b'Follow along to learn more about my legislation, the Desert Tortoise Habitat Conservation Plan Expansion Act. https://t.co/lHAHPpRnTh'",Republican
RepTedYoho,b'I will be on @FoxNews today at 1:15pm EST to discuss the upcoming summit with #NorthKorea and the dismantling of their nuclear test site.',Republican
RepLaMalfa,"b""Congratulations to Cadet 1st Class Ryan Silva from Auburn, California for being named the top graduate of the U.S. Air Force Academy class of 2018! I nominated Ryan for the Academy back in 2014, and he has since proven to be one of Northern California's, &amp; the country's, finest! https://t.co/bLHAgzguy9""",Republican
RepWalorski,"b'Thanks to these Hoosier air traffic controllers who stopped by with @NATCA to discuss recruitment and other important efforts to improve safety, leadership, and efficiency in the aviation industry. https://t.co/jLDSRdgi2F'",Republican
RepDougCollins,"b""The #OpioidEpidemic represents one of the most devastating yet complex challenges of our day, and it demands a holistic response. I've introduced the Substance Abuse Prevention Act with @RepTedDeutch as part of that response. \xe2\x86\x92 https://t.co/ptIukS5Qjg""",Republican
RepMullin,b'Congress continues to work diligently to find solutions to the #OpioidCrisis. Check out @GOPLeader McCarthy\xe2\x80\x99s op-ed in @USAToday: https://t.co/RLrMX8pT5v',Republican
RepDeSantis,b'Exhibit A as to why Congress needs to authorize the Trump border wall. Fentanyl is now driving the opioid crisis \xe2\x80\x94 we can\xe2\x80\x99t solve the crisis without a secure border! https://t.co/8TlMCBPy3z',Republican
RepHolding,"b'Yesterday, the Ways and Means Committee advanced the Medicare and Opioid Safe Treatment Act. Medicare beneficiaries have among the highest and fastest growing rate of opioid use... https://t.co/Y6tgXSkFxh'",Republican
RepTomRice,"b'Jobs, Jobs, Jobs in #SC07 https://t.co/7Vj2bxfhFM'",Republican
RepChrisCollins,b'Tax reform is working by allowing more Americans to keep more of their hard earned paychecks. The National Association of Manufacturers recently reported that 72% of manufacturers plan to increase wages or benefits for workers #TaxReformWorks',Republican
TXRandy14,b'The bravery displayed by Santa Fe students saved countless lives. Their heroism will always be remembered. https://t.co/k4FW9Re9bZ',Republican
RepAnnWagner,"b'This morning, I had the privilege of meeting with and hearing testimony from our former colleague and now Secretary of State, @SecPompeo. Thanks to Secretary Pompeo and President Trump\xe2\x80\x99s efforts, U.S. foreign policy is on the right track. https://t.co/Sr4qyisFEl'",Republican
RepKevinCramer,b'Nice to visit with Shannon Radke about the SEC\xe2\x80\x99s proposed Best Interest rule and its potential impact on consumers and small businesses. https://t.co/6YBK43wHO4',Republican
RepLukeMesser,b'Our family is praying for Indiana\xe2\x80\x99s former First Lady Susan Bayh. All Hoosiers are with her and the entire Bayh family during this difficult time.',Republican
RodneyDavis,b'Very cool! Thank you to all those who serve. https://t.co/0jiV8mHwkv',Republican
RepDaveJoyce,"b'Throughout the month of May, I\xe2\x80\x99ve had the pleasure of meeting with students from all over the district. Special thanks to @KirtlandSchoolsOH, @BBHCSD, and @SFAschoolGM for paying a visit to our nation\xe2\x80\x99s Capitol! https://t.co/yfup44mphg'",Republican
RepThomasMassie,"b'Completely agree!  I\xe2\x80\x99d go a step further and allow all Americans, desperate or not, to have the #RightToTry as long as no one else is harmed. https://t.co/QJk5ucqreX'",Republican
RepMarkMeadows,"b""It is time for Americans to hear the truth about what happened at the Department of Justice on their taxpayer dime. It is time for a second special counsel.\n\n@RepLeeZeldin introduced a resolution on this yesterday. Let's put it to a vote. Enough with the DOJ's obstruction. https://t.co/2S4Dx07O8N""",Republican
RepAndyHarrisMD,"b""I applaud the Trump Administration's proposal to update #TitleX rules to exclude programs where abortion is a method of family planning. @POTUS is keeping his #ProLife promises and ensuring that Title X funding is used to provide quality family planning to low-income families. https://t.co/oUzghIjvKr""",Republican
RepPittenger,"b'Yesterday, my landmark national security bill was unanimously approved by the @FinancialCmte. This bill modernizes the review process for potential foreign investments that threaten our national security. Learn more:\nhttps://t.co/WBrq7PuQC8'",Republican
MikeKellyPA,b'Today @SenatorEnzi &amp; I sent a joint letter to @POTUS \xe2\x80\x94 signed by 80 members of Congress \xe2\x80\x94 calling on his admin to take action to defend faith-based adoption/foster care services (like those in Philly &amp; elsewhere) that have been forced to stop helping kids: https://t.co/goojQqtnPs',Republican
RepRichHudson,"b'Today I spoke on the House floor in honor of #AAWXXIX. There is ready... and then there is @82ndABNDiv ready. As the old saying goes, \xe2\x80\x9cwhen the President dials 911, the phone rings at @FtBraggNC.\xe2\x80\x9d \xf0\x9f\x87\xba\xf0\x9f\x87\xb8\n\nAirborne - all the way! #AAWXXIX  https://t.co/I3U1whq1Ms'",Republican
PatTiberi,"b'To the people of Ohio\xe2\x80\x99s 12th Congressional District, thank you for giving me the honor to represent you in the US House of Representatives for the last 17 years. It has been a great privilege. Thank you, and God bless you.'",Republican
JimPressOffice,"b'Today, I cannot be any prouder of his achievements and congratulate him on being confirmed to the 7th Circuit Court of Appeals. https://t.co/SGtKQWU4cM'",Republican
RepLanceNJ7,b'Great news. New Jersey has more Superfund sites than any other state. I worked with @USRepRodney and we fought for and won a $66 million increase in the fiscal 2018 funding package to speed cleanup of Superfund sites like American Cyanamid in Bridgewater. https://t.co/G25LVZ34uG',Republican
RepDLamborn,"b""I joined General Thompson and several Airmen from Colorado Springs to talk about the importance of space defense in the U.S.'s future national security plan. The Air Force has already made tremendous strides towards developing space warfighters ready to deter, defend, and prevail https://t.co/IvmmMFGaOY""",Republican
RepHalRogers,b'Congratulations to Gail Wright on her retirement after dedicating nearly 30 years as Executive Director of the Gateway Area Development District! https://t.co/AuC0uy7lQA',Republican
RepBradWenstrup,"b'.@WaysandMeansGOP is working to bring flexibility, transparency, and outcomes to state programs for workforce development. Watch our markup of the JOBS for Success Act. \n\nWatch live: https://t.co/TdpG2DmVtI'",Republican
MarkAmodeiNV2,b'Tune into @TuckerCarlson live tonight around 8:20 PM ET (5:20 PM PT) on @FOXNews. I\xe2\x80\x99ll be joining him to discuss immigration reform and securing our border.',Republican
MacTXPress,"b'House passes Economic Growth, Regulatory Relief, and Consumer Protection Act https://t.co/zpFYdj4Yjp'",Republican
RepDavidYoung,b'Saturday I walked for my aunt and a friend and all those who live with MS. I joined many in Des Moines who were there supporting loved ones or who knew someone affected by MS. Thank you to all for their support! #IA03 https://t.co/mkTKkp5Lm7',Republican
HouseAppropsGOP,b'The Committee has approved the report on the suballocation of the budget allocations for fiscal year 2019 (the 302(b)s) on a vote of 29-22.',Republican
RepAdrianSmith,b'Enjoyed seeing students from Adams Central High School at the @uscapitol and answering their great questions on current events. @goacpatriots https://t.co/RhMUKs1yNa',Republican
ConawayTX11,"b'Glad to have you in DC, Dr. May! https://t.co/7SPUjCnG8j'",Republican
HouseVetAffairs,"b'""With today\xe2\x80\x99s Senate action, veterans are one step closer to the care they deserve, and I thank @SenatorIsakson and @SenatorTester for championing this bipartisan measure in the Senate."" -Chairman @DrPhilRoe https://t.co/cvn9sB5dt6'",Republican
RepWebster,b'HHS new policy prohibits medical clinics from spending any taxpayers on abortions. It preserves funding for the many clinics in our communities that provide healthcare and family planning for low-income women. Thank you @realDonaldTrump for protecting life of the unborn!',Republican
MarshaBlackburn,"b'Thank you, @the_USO for the opportunity to assemble care packages for our troops yesterday- a small way to show our appreciation &amp; support for the brave men &amp; women who serve our country so honorably. #MilitaryAppreciationMonth https://t.co/oO6Khtt8dh'",Republican
RepJoeWilson,"b""OTD: May 23, 1788, South Carolina was the 8th state admitted to the Union! Let's all wish our beloved state a very happy birthday! #HappyBirthdaySC #PalmettoBirthday https://t.co/exRVxEl2m8""",Republican
RepKevinYoder,"b'This is an approach that is based on evidence, rooted in compassion, and represents another plank in our economic agenda to help move our country forward and improve life for all Americans.'",Republican
RepTomReed,"b'As always, it is great to continue these critical conversations with my friend and co-chair, @RepJoshG. 4/4  https://t.co/dq7u7K6kpo'",Republican
SamsPressShop,"b'Praying for the students, teachers, staff, and families of the Santa Fe High School. So thankful for quick-thinking student who pulled the fire alarm and the response of our law enforcement.\n\nhttps://t.co/Jvq5tw7XBM'",Republican
RepJeffDenham,"b'Yesterday, I voted in support of a prison reform bill to provide training programs and reduce recidivism rates. Prison reform is also underway at home with the @StanSheriff REACT Center. I toured the facility and donated @librarycongress books recently: https://t.co/ISyn4PI7Wf'",Republican
RepEdRoyce,b'3 Major Wins in Regulatory Relief Bill:\n1. Unleashes billions in capital for small businesses.\n2. Provides potential homeownership for 26 million \xe2\x80\x98credit invisible\xe2\x80\x99 consumers. \n3. Empowers new companies to tap into nationwide capital markets.\n\nRead more: https://t.co/5ZXBP3xlaN https://t.co/Cu3gGiYLIp',Republican
Raul_Labrador,"b'Today, I voted 4 (and the House passed) S. 2155, a bill introduced by @MikeCrapo that repeals some of the worst aspects of the Dodd-Frank law. Sen. Crapo\xe2\x80\x99s bill is an important first step in fully repealing Dodd-Frank. It will spark more investment &amp; growth, in #Idaho &amp; America.'",Republican
HerreraBeutler,"b'To all those who attended our Job Hunting Workshop today, thank you for coming and I wish you all the best on your journey! Looking forward to seeing many of you at our Jobs Fair on May 29. I also want to thank all our panelists for your valuable time today. https://t.co/iwgDpcPZQo'",Republican
RepTipton,"b""Opioid abuse is an epidemic that is plaguing our nation, and Colorado has been hit especially hard. That's why Congress is working to find solutions to fight this epidemic. Be sure to check out @GOPLeader McCarthy\xe2\x80\x99s op-ed to learn more: https://t.co/IvPiFI5c2t""",Republican
RepFrankLucas,b'This morning I had the opportunity to join Secretaries Zinke and Perdue at a USDA roundtable meeting to discuss wildfire recovery efforts and address ways to minimize and prevent damages in the future. https://t.co/HcvGhXfhca',Republican
CongressmanDan,b'#CelebrateFP https://t.co/5PfbiA3nsE',Republican
RepCharlieDent,"b""An important read from CNN's @FoxReports on the #ImmigrationReform debate dynamics in the House.  'Moderates use conservative playbook on immigration' @CNNPolitics https://t.co/jQsgEvRKe3""",Republican
RepLoBiondo,b'House debating amendments to National Defense Authorization Act tonight/tomorrow. Critical military planning bill passed Armed Services Committee with strong bipartisan vote. Look forward to House approving heading into Memorial Day. #FY19NDAA',Republican
RepGosar,b'Happening now! Tune in to @FoxBusiness to watch my interview with @LouDobbs.',Republican
RepMcKinley,"b""I joined @KeithRothfus on an op-ed detailing the need to secure America's electric grid. From extreme weather to cyber attacks, our grid is vulnerable due to the closures of coal and nuclear power plants. Click the link to read more. \nhttps://t.co/WGHhabk5bh""",Republican
RepJeffDuncan,"b'@MaryCaitlinByrd and ""requires players to stand if they are on the field during the performance.""'",Republican
