RepBarbaraLee,"b'We need to end the failed #WarOnDrugs &amp; start building an equitable, inclusive cannabis industry. My bills, the #MarijuanaJusticeAct &amp; the #REFERAct, will help reform our outdated policies while keeping the federal govt from meddling in state &amp; local laws. https://t.co/LslONNhJxv'",Democrat
sethmoulton,b'Our democracy is endangered when we cannot discuss issues before voting on them. We\xe2\x80\x99ve been attacked online before and cyber threats will only become more severe \xe2\x80\x93 yet GOP leadership rejected my amendment to protect the role of the NSC cyber coordinator without even a debate.',Democrat
RepJimCosta,b'I had a great discussion about how to improve our water infrastructure with the #California representatives from the @phccnatl this morning.\n\nIt was a special honor to be given their leadership and service award. https://t.co/m8C7H6O15A',Democrat
nikiinthehouse,"b'I just signed onto the discharge petition that would force the House to vote on legislation to preserve #NetNeutrality. I will continue to stand for a free and open internet, and I hope more of my colleagues will do the same. https://t.co/ci6fJgG2wv'",Democrat
RepMcGovern,"b'BIG NEWS: House passed my #bipartisan amendment to honor 225,000+ American #veterans who put their lives on line in #nuclear weapons tests between 1945 and 1966. America must always honor our veterans. This recognition is long overdue. Senate must do the same. https://t.co/Hhy4n6IQ9s'",Democrat
RepYvetteClarke,b'I look forward to seeing you all at the Brooklyn launch of our #SmartCitiesCaucus next Tuesday. RSVP here: https://t.co/XdeeQMGcYN https://t.co/2SGt34LW8R',Democrat
RepKarenBass,"b'No one knows the child welfare system like current and former foster youth. Today, I was joined by Megan, who flew across the country for the first time to share her experience in the child welfare system with me. \n\nThank you for your bravery.\n\n#FosterYouthVoices https://t.co/pQ1Rj7Xm9x'",Democrat
USRepRHinojosa,"b'Yesterday evening, I was recognized and presented a proclamation by the Board of Directors of Affordable Homes of... https://t.co/GO0rzxmYFW'",Democrat
JohnCarneyDE,"b'Joined members of the Rehoboth Beach-Dewey Beach Chamber of Commerce this afternoon and talked about supporting small businesses, strengthening our workforce, and reducing rising health care costs. #DelBiz https://t.co/NE49Fd9pVD'",Democrat
NormaJTorres,b'This is shameful. These young Native American athletes shouldn\xe2\x80\x99t be punished simply for reporting abuse. https://t.co/fMJxhceXDs',Democrat
RepHanabusa,"b'America\xe2\x80\x99s teachers are underpaid, our schools are underfunded and that means our children are often denied access to the quality public education they need to succeed. They deserve #ABetterDeal  https://t.co/4OsLiSWLwF'",Democrat
RepWilson,b'. @NancyPelosi tells colleagues that their political survival is nowhere near as important as our children\xe2\x80\x99s survival. https://t.co/P44iYdnCRe',Democrat
USRepKeating,"b'Once again, we must ask: When will Speaker Ryan allow this Congress to do something to protect our kids and citizens so we can come together and say never again?'",Democrat
JoaquinCastrotx,b'Joining @CNN @andersoncooper @AC360 tonight at 7:40pmCT/8:40pmET to discuss tomorrow\xe2\x80\x99s @TheJusticeDept @FBI briefing that excludes #Democrats.',Democrat
RepBrendanBoyle,"b'@refrigman1 Yes. I encourage you to sign up on our website to receive our newsletters and emails where I provide updates on each of the issues you cited, as well as others.'",Democrat
NitaLowey,"b'""We write today to call on the Postal Service to implement a broad, aggressive program to combat robberies and theft of mail across the Hudson Valley,"" the letter said. https://t.co/TXua7Tc8O4'",Democrat
RepCuellar,"b'Today, I met with Governor Carlos Hisa and Samantha Villarreal of Ysleta Del Sur Pueblo to discuss Texas tribal issues. https://t.co/rb2po7GOjk'",Democrat
RepAndreCarson,"b""Today I was privileged to host Nancy, a former foster youth from #Indy for Congressional Foster Youth Shadow Day! Nancy was among the many #FosterYouth who came to Capitol Hill to shadow Members of Congress &amp; discuss how to improve America's child welfare system. https://t.co/pYdIyec115""",Democrat
RepVisclosky,"b'Thank you to all of the attendees and presenters at last week\xe2\x80\x99s Military Academy Night. For those unable to attend, all the information is available through this link: https://t.co/klUGMYbyhb https://t.co/Rkerq44Nje'",Democrat
RepJudyChu,"b""In 2018 America, your race, ethnicity, and zip code can still determine your access to healthcare. That's why the Congressional Asian Pacific American, Black, and Hispanic caucuses teamed up to ensure all Americans have equal access to healthcare. https://t.co/4lli2ih7ge""",Democrat
Clyburn,"b'Many thanks to @RepCummings, @OversightDems and the staff for their help on this report: https://t.co/JQvfuLYER1 on the #GOPTaxScam'",Democrat
LloydDoggettTX,"b'On this runoff Election Day, remember that the most important form of exercise is exercising your right to vote. Find your polling place at\xc2\xa0https://t.co/zkbIIo2iD1\xc2\xa0and vote today!'",Democrat
repdavidscott,"b""Today I took to the House Floor to condemn the 2018 Farm Bill for its separate and unequal treatment of our nation's 1890s Land Grant African-American Universities. It's time for these schools to finally be treated with the respect and dignity they deserve. https://t.co/2JsIjOpEG1""",Democrat
RepEBJ,b'Atencion #DREAMERS! Si cumplen con los requisitos califican para solicitar su renovaci\xc3\xb3n. USCIS esta aceptado aplicaciones de renovaci\xc3\xb3n. Les aconsejamos que lo hagan lo mas r\xc3\xa1pido posible.',Democrat
NydiaVelazquez,"b""TOMORROW, THURSDAY, 10 a.m. on Capitol Hill at House Triangle, I'll be joining @HispanicCaucus in calling for @BetsyDeVosED to retract her statement saying schools can locally determine whether to call ICE on undocumented immigrant students!""",Democrat
RepEliotEngel,"b'Yesterday, @HouseGOP continued their march backwards by passing the most significant weakening of #DoddFrank since the law was first written in response to the #GreatRecession. The banking industry needs more scrutiny, not less. Read my statement: https://t.co/EjDlQl7RSd'",Democrat
repcleaver,"b""#TeamCleaver was also in Slater to see the new utility truck and firefighting equipment acquired by the city via grant from @usdaRD. The partnership between Slater and USDA RD allowed for this life-saving equipment. That's why I'll continue fighting to protect @USDA programs. https://t.co/nBoZES1wD4""",Democrat
RepCohen,"b'Pleased House OGR Committee passed my bill to name #USPS bldg@ 1325 Autumn Ave in #Memphis the Russell B. Sugarmon Post Office Bldg. No one deserves this more than Judge Sugarmon,2nd #AfricanAmerican elected to TN Gen Assembly&amp; trailblazer for #CivilRights https://t.co/9MKjungvPi'",Democrat
BobbyScott,b'Further proof that the #GOPTaxScam put corporations and the wealthy over workers. https://t.co/oUp2QrGSUH\xe2\x80\x9d',Democrat
gracenapolitano,"b'ATTENTION DREAMERS! Right now, you can still apply to renew your DACA. If you meet the requirements to apply for DACA renewal, you should apply \xe2\x86\x92 https://t.co/hDTSLEgs7j https://t.co/nZ6viusAiZ'",Democrat
RepAlGreen,"b"".@SpeakerRyan bring the gun safety bills we have pending to the floor of the House for a vote. The American people need solutions, not just moments of silence for another group of victims. If you won't act, step aside. https://t.co/rMQXaqeY5y #ActionNotTalk #SantaFe #Parkland""",Democrat
RepDavidEPrice,"b""\xe2\x86\x928 indictments of 19 people &amp; 3 businesses\n\xe2\x86\x925 guilty pleas\n\xe2\x86\x922 criminal cases headed to trial\n\xe2\x86\x921 person already serving prison sentence\n\nThe Special Counsel isn't hunting witches, he's catching criminals and uncovering corruption. https://t.co/FffQDwIoyJ""",Democrat
RepMarciaFudge,"b'In 2 days, foster youth from across the country will be meeting with Members of Congress to help our government improve the child welfare system. Looking forward to being part of this important conversation. #FosterYouthVoices. #Supportouryouth https://t.co/i1HxPuZagK'",Democrat
RepBrady,"b'Children on #SNAP are more likely to graduate, break the cycle of poverty, and contribute to a productive and efficient economy in the future. \xe2\x80\x9cAnd a child shall lead.\xe2\x80\x9d #NoHouseFarmBill #ProtectSNAP #HandsOffSNAP https://t.co/ZXZAXrq7j4'",Democrat
rosadelauro,"b'Right now, you can still apply to renew your DACA. If you meet the requirements to apply for DACA renewal, you should apply \xe2\x86\x92 https://t.co/fAHHjqyeBZ https://t.co/qKYK00b2pZ'",Democrat
RepJohnConyers,b'I am grateful to my colleagues who have called for due process before weighing judgment. I would urge them to continue to do so for any Member accused of wrongdoing. Basic fairness requires no less.',Democrat
RepTedDeutch,"b""If your member of Congress isn't fighting to end gun violence then they are neglecting a critical issue that could affect any American at any time. Thank you to @NancyPelosi @RepThompson @RepWilson for being on the right side of this issue and joining me for this important forum.""",Democrat
AGBecerra,"b'Every student, regardless of immigration status, is entitled to feel safe &amp; secure at school. Our office issued guidance to help schools better understand protections that safeguard the privacy of students &amp; families. View our checklist &amp; guidance: https://t.co/D4MjG7vyaQ https://t.co/yMaBuTmzOF'",Democrat
RepJimMcDermott,b'Tomorrow I begin my retirement from public service. It has been a tremendous honor to serve as your Congressman. Thank you. https://t.co/RwgWshKc81',Democrat
RepSheaPorter,"b'This afternoon, I joined a Democratic hearing on #gunviolence prevention featuring a panel of high schoolers who have been affected by violence. These kids are so brave and are leading the way in getting Congress to take action. It\xe2\x80\x99s time for Speaker Ryan to listen. #neveragain https://t.co/MNueYgKszp'",Democrat
repdinatitus,"b""Today I offered an amendment to the Army Corps Reauth. in support of the important restoration work in the Lake Tahoe Basin. Tahoe is a critical economic engine in the Sierra Nevadas. I'll continue to fight for this program. https://t.co/rngLsK50F8""",Democrat
DWStweets,"b""I'm so proud of my fellow Florida Gators and yes, even the Seminoles, for refusing to let Rick Scott stand in the way of the right of students to access the ballot box and make their voices heard. https://t.co/gnUospLvbG""",Democrat
collinpeterson,b'Tomorrow I would appreciate your vote to continue working as your common sense Congressman in #MN07 : http://t.co/qWkJV1GVMd',Democrat
RepRonKind,b'One of my favorite summer traditions is driving across Wisconsin with my family to local county dairy breakfasts. Check out the link below to find a dairy breakfast near you! \xf0\x9f\xa7\x80\xf0\x9f\xa5\x9b\xf0\x9f\x90\x84\nhttps://t.co/SQVTat9TXE',Democrat
repjoecrowley,b'@KolbeNelson @NYCTSubway looking into it! Will be back with an answer ASAP.',Democrat
RepGeneGreen,"b""If you\xe2\x80\x99ve never applied for #DACA before, you may not apply for DACA now. Only people who have had DACA at some point can submit a renewal application. **NOTE: This hasn't changed because of the recent court ruling on DACA.** Apply \xe2\x86\x92 https://t.co/m0l8lAK64h. https://t.co/ygVnX1dAXy""",Democrat
LorettaSanchez,"b'Our veterans make our country proud. On #VeteransDay, we honor their sacrifices and their bravery https://t.co/yBTmhe1kEp'",Democrat
RepDwightEvans,b'The # of thoughts &amp; prayers Republicans have offered in the wake of tragic gun violence far succeeds the # of times they have joined my Dem colleagues and me on legislation to enact common-sense #gunreform.\n\nThe time for action is NOW\xe2\x80\x94myself &amp; thousands of others have had enough!',Democrat
RepGaramendi,b'I had a great time meeting with @OrganicTrade members today to discuss how we can support organic agriculture and products in Congress. https://t.co/M5I10zGXK1',Democrat
RepSchakowsky,"b""Progressives Sound Alarm Ahead of Tuesday House Vote on 'Bank Lobbyist Act' https://t.co/VAFnn0tZAW""",Democrat
RepJoeCourtney,"b'This week we are marking #NationalMaritimeDay, serving as an opportunity to recognize one of our nation\xe2\x80\x99s most important industries. Eastern CT is home to one of the country\xe2\x80\x99s strongest maritime economies. A special thanks to our region\xe2\x80\x99s hardworking maritime industry workers.'",Democrat
RepPaulTonko,"b""Thanks @USRepMikeDoyle for your leadership on this generation-defining issue. I'm proud to be fighting to restore #NetNeutrality &amp; a level playing field for America's #smallbiz &amp; consumers! https://t.co/N4zsUbcxjP""",Democrat
repdonnaedwards,"b""As of Dec 15, I'll no longer tweet from this account. Please stay in touch by following me @DonnaFEdwards Thank you for the privilege. \xe2\x9d\xa3\xef\xb8\x8f\xf0\x9f\x87\xba\xf0\x9f\x87\xb8""",Democrat
BennieGThompson,b'Congressman Thompson\xe2\x80\x99s statement for NO vote on #GOPFarmBill: https://t.co/rvPrfBcKR2',Democrat
JacksonLeeTX18,b'Congratulations to the @HoustonRockets on the win tonight in Game 4 over @warriors! \xf0\x9f\x9a\x80 \xf0\x9f\x8f\x80 #RocketsNation #Rockets @TilmanJFertitta  #HoustonStrong',Democrat
GerryConnolly,b'This is the sound of cement cracking around the ossified feet of the SCOTUS. We must have cameras in the court.\n\nhttps://t.co/Fp8doA8o93',Democrat
mikecapuano,"b""I'll continue to stand up to Donald Trump, whose actions hurt women and families in every community. Women, and our entire country, deserve better. Join me in standing with Planned Parenthood: https://t.co/dJS2iohNMg""",Democrat
BillPascrell,b'I always enjoy welcoming @steelworkers to Washington. We need their common sense in standing up for a living wage and the dignity of working Americans. #USWWorks #solidarity #District4 https://t.co/sPpnyTEYRA',Democrat
louiseslaughter,b'The #FlintWaterCrisis epitomized what is actually a nation-wide crisis and Federal investment in water infrastructure is needed to truly address this burgeoning problem. https://t.co/KanV3kKft5',Democrat
RepAdamSmith,b'Read more here \xe2\x86\x92https://t.co/5NIkBzxhj7 @HighlineSchools',Democrat
RepMikeQuigley,"b'Smaller government? Not when it comes to women\xe2\x80\x99s #healthcare. Now Trump is using the gov to dictate what doctors can tell their patients. \n\nRT to tell this Administration: #NoGagRule, which will only serve to shut down providers &amp; cut vital services. https://t.co/KiEQQMnmnO'",Democrat
RepJohnLarson,"b'This morning\xe2\x80\x99s announcement that @UTC will hire 2,000 workers in CT is great news for our state and demonstrates our strength as a hub for manufacturing, innovation, and as a home to a skilled workforce. I thank UTC for their commitment to our state! https://t.co/v2TdNgOCU1'",Democrat
chakafattah,b'@TheStreet https://t.co/evNUAVfCpV',Democrat
JuliaBrownley,"b""Even Trump's own former HHS Secretary is admitting it: The #GOPTaxScam is driving up health care prices. It's long past time for Republicans to come to the table to work on a bipartisan plan to bring down healthcare costs for hard-working families. https://t.co/41ZwHcYwen""",Democrat
AlanGrayson,b'My first broadcast ad starts today! Check it out. \n#UnboughtUnbossed https://t.co/pp4SljEo5W',Democrat
RepJerryNadler,b'Read my statement on @realDonaldTrump and @HouseGOP\xe2\x80\x99s reckless and dangerous effort to pressure the Department of Justice into exposing the identity of a top-secret FBI source. https://t.co/D1LyKIfLvw',Democrat
USRepMikeDoyle,b'New poll shows strong support for #NetNeutrality across the political spectrum and among all age groups. \n#SaveNetNeutrality \nhttps://t.co/MgJ8wnolCJ',Democrat
DorisMatsui,"b'Today I had the pleasure of participating in #FosterYouthShadowDay with Israel from Sacramento. Thank you, Israel, for sharing your story and your ideas! https://t.co/A4saywRM5k'",Democrat
RepGutierrez,"b""Tell me something I don't know... https://t.co/ohqaXTICGC""",Democrat
RepMaxineWaters,"b'The moment of keeps: Giuliani, keep talking. Mueller, keep connecting the dots. Rosenstein, keep saying no. Stormy, keep storming.'",Democrat
pedropierluisi,b'A las 4:15 comenzar\xc3\xa1 la conf de prensa sobre las recomendaciones reveladas por Task Force Promesa. Estaremos en vivo a trav\xc3\xa9s de FB live.',Democrat
RepBrianHiggins,b'Great news for the @WNYLC DL&amp;W Trail project https://t.co/7mWNnUPdx2',Democrat
RepJoseSerrano,b'Want to support our children &amp; their education? Support their teachers. #ABetterDeal https://t.co/ffNqlBSriW',Democrat
FrankPallone,"b'Right now, you can still apply to renew your DACA. If you meet the requirements to apply for DACA renewal, you should apply \xe2\x86\x92 https://t.co/xldxDBxcdj https://t.co/vFllN7hKcU'",Democrat
jahimes,"b'It may be true that the center cannot hold and mere anarchy is loosed upon the world, but at least the world has figured out to serve bacon...alone...just bacon. https://t.co/sGhpaDaP7t'",Democrat
BradSherman,b'#PaperTiger on #NorthKorea.  @realDonaldTrump fails to sanction major Chinese banks doing business with North Korea. See my bipartisan letter of criticism. https://t.co/UverWZ8Arz',Democrat
RepAdamSchiff,"b'There\xe2\x80\x99s a reason why this is the most scandal-plagued Administration in modern history. When you combine an unethical President with one-party rule, it is an invitation to ruin. Power corrupts, and Trump\xe2\x80\x99s absolute power has corrupted all too absolutely.'",Democrat
repjohnlewis,"b'Separating children from their parents is cruel, it is inhumane, and it is not in keeping with the moral values of our nation. It is simply un-American. I will fight this action with every fiber of my being. https://t.co/jyrwTPOxHO'",Democrat
RepRaulGrijalva,"b'#DidYouKnow that you can still apply for a #DACA renewal even if your last application was rejected for not meeting the October 5, 2017 deadline? If you meet the requirements, submit your renewal application ASAP.   https://t.co/wENidcoufa'",Democrat
RepDianaDeGette,"b""I joined @PPFA today in pushing back on @POTUS' new #TitleX domestic gag rule. Women deserve access to \xe2\x80\x93 as well as knowledge of \xe2\x80\x93 the full range of #reprorights available to them. Forcing health care providers to censor this information is not only wrong, it's dangerous. https://t.co/oN0VEucc8F""",Democrat
repsandylevin,"b'In a recent report by the non-partisan CBO, an estimated 3 million more Americans will lose health insurance between 2018 &amp; 2019 due to rising premiums mainly attributed to the #GOPTaxScam. https://t.co/TVqMZeGJvF https://t.co/UE6YEoduh2'",Democrat
RepSpeier,"b'Everyone who lost their #DACA protections, now is THE time to regain or renew your protections. Your application process will depend on whether your DACA expired before or after September 5, 2016, so be sure to check out how to apply at https://t.co/zxOF5bY462.'",Democrat
RepHankJohnson,"b'Right now, you can still apply to renew your DACA. If you meet the requirements to apply for DACA renewal, you should apply \xe2\x86\x92 https://t.co/Ly9835QQyj https://t.co/r4mcevn3s9'",Democrat
janschakowsky,"b""I'll be on the House floor discussing how @HouseDemocrats have #ABetterDeal for our democracy. Tune in!\n\nhttps://t.co/1ZxHOo7NsW""",Democrat
EleanorNorton,"b'Great news for DC students and families! We preserved #DCTAG funding in the House DC appropriations bill, released today, despite it being zeroed out in Trump\xe2\x80\x99s budget. With DC students in colleges across the nation, protecting DCTAG funding is always my first priority.'",Democrat
RepGregoryMeeks,b'You can still apply to renew your DACA - Check here if you meet the requirements and apply for your DACA renewal! #ProtectDreamers \xe2\x86\x92 https://t.co/EMBFyxEKpH https://t.co/mMbyBpig1v',Democrat
RepGwenMoore,"b'.@realDonaldTrump\xe2\x80\x99s gag rule is an attack on women\xe2\x80\x99s access to basic care like birth control, cancer screenings &amp; STD treatment. It\xe2\x80\x99s an attack on women\xe2\x80\x99s rights. #NoGagRule https://t.co/CIKv30idyV'",Democrat
repjimcooper,"b'This decision will undermine local law enforcement and school officials, and increase fear and mistrust in our communities. A cruel law that will only create new problems. https://t.co/GB7tePAZBb'",Democrat
WhipHoyer,"b'Wishing everyone, especially @UofMaryland #Terps, a happy #WorldTurtleDay! #FearTheTurtle #GoTerps https://t.co/ZG3EfOVO3F'",Democrat
cbrangel,"b""I'm sad to leave the office I've occupied for decades but am glad to see my dear friend will carry it on! I'll visit soon. https://t.co/P6yLE2EvWV""",Democrat
RepPerlmutter,b'We must stop letting people here at home &amp; in other countries undermine the integrity of our election systems. And we must protect every American\xe2\x80\x99s right to vote. We need to ensure  #ABetterDeal for our democracy.',Democrat
RepSchrader,"b""There are 24 sea lions at the base of Willamette Falls gorging on the salmon spring run right now. @MyODFW says there's a 90% chance the Willamette Winter Steelhead run will go extinct in the next few years if we don't act. We must pass my bill, HR 2083, now! #SaveOurSalmon https://t.co/YsfwzynFRC""",Democrat
RepSteveIsrael,b'Hear the first excerpt from the audiobook edition of #BigGuns from @SimonAudio: https://t.co/T1Q7GdL6GE\n\nDownload your copy today:\nAudible: https://t.co/yvtnoBA8D6\nGoogle Play: https://t.co/nDU3GUYqwB\niTunes: https://t.co/3BPJ1jbeZs https://t.co/Kvy9mK4uQK',Democrat
repbenraylujan,b'My heart is broken to learn of yet another mass shooting. That this is the third school shooting in America this week alone is unacceptable. We must take action to ensure our children no longer have to go to school scared for their safety. #SantaFe #NeverAgain',Democrat
JimLangevin,"b'One step we can take to reduce #gunviolence is to prevent children from gaining access to unsecured firearms. Today, I introduced the Child Access Prevention Act to ensure guns are stored safely. #EnoughIsEnough https://t.co/fEe6B45tC5'",Democrat
RepSires,b'Spoke with Melvyn Bray about the charitable work of @lionsclubs at home in NJ and around the world https://t.co/Jz82yKdvas',Democrat
RepMikeHonda,"b""I joined @democracynow to discuss @realDonaldTrump's unacceptable, unAmerican proposal for a #MuslimRegistry https://t.co/iA2qSJWHPM""",Democrat
repblumenauer,"b""I've never met a person who thinks it's a good idea for state-legal marijuana businesses to be forced to operate on a cash-only basis. These businesses just want to pay fair taxes w/ a check. Yet the federal govt remains in the way. We have the legislation. Now, Congress must act https://t.co/2UlGSmkNdZ""",Democrat
NancyPelosi,"b'.@realDonaldTrump said he would allow Medicare to negotiate \xe2\x80\x9clike crazy\xe2\x80\x9d to lower the cost of prescription drugs. Apparently, \xe2\x80\x9clike crazy\xe2\x80\x9d means not at all. #PelosiTownHall'",Democrat
chelliepingree,"b'Thank you to Casey Smith of @CityPortland for helping to make #FosterYouthVoices heard on Capitol Hill during National Foster Youth Month. We must ensure every child has the resources to grow up in a safe, loving home. #mepolitics https://t.co/ILGQqNvNdr'",Democrat
keithellison,b'Stop Calling It an Arbitration Agreement\xe2\x80\x94Employers Are Forcing Workers to Give Up Their Rights https://t.co/hBlfTq0CqC',Democrat
RepTimRyan,b'Thank you Senator @Sean_J_OBrien and thank you for your leadership. #TJX https://t.co/JdTBSBny2A',Democrat
RepRalphNorman,b'Thank you for coming in and meeting with me @sccepnews ! https://t.co/CWbgXSNz52',Republican
RepTomGarrett,b'HAPPENING NOW: @SecPompeo testifies before @HouseForeign. Watch live HERE \xe2\x86\x92 https://t.co/cVIj9cETLL\nhttps://t.co/zSrb6rynHw',Republican
RepArrington,"b'A BIG congratulation is in order to Rickey Bearden of Plains, Texas for his appointment to this critical board \xe2\x80\x93 one that ensures economic stability through efficient and effective crop insurance. I am confident that he will represent our region and the entire ag industry well!'",Republican
RepJimBanks,b'Welcomed 8th grade students from @HolyCrossFW to the U.S. Capitol today between votes. No surprise that these Hoosier students were smart and witty! https://t.co/ToyekUaGdS',Republican
RepJasonLewis,b'Both federal and state efforts are in play to restructure Minnesota\xe2\x80\x99s Met Council. Gov. Dayton- now is the time to make certain the Met Council is accountable to taxpayers. \nRead more on the issue here https://t.co/ZcPLDzrmaC \n#MN02',Republican
RepGallagher,"b""In just two months from now, we will once again adjourn for a month-long recess without getting our work done. This is unacceptable. I urge my colleagues: let's cancel the recess, stay in session, and do our job. https://t.co/9eLl9QrKhW""",Republican
DrNealDunnFL2,b'Just spoke on the House floor in support of the National Defense Authorization Act (NDAA) and my amendment to modernize the F-22 wing at Tyndall Air Force Base. https://t.co/K6ufV8hIid',Republican
RepJohnFaso,"b'I led a bipartisan coalition in introducing legislation to reauthorize the school-based health center program, which is vital for students and their families in under-served rural communities. Read about this worthy program &amp; our effort to reauthorize it: https://t.co/jgacKcAqi1'",Republican
